{
  "schema_version": "1.0.0",
  "resource_id": "symptom_classifier",
  "resource_type": "model",
  "description": "Classifies symptoms into diagnostic categories.",
  "content": {
    "type": "model/spec",
    "data": {
      "interface": "http",
      "endpoint": "https://ml.example.org/symptom-classifier",
      "signature": {
        "inputs": [
          "symptom_text"
        ],
        "outputs": [
          "diagnosis_label",
          "confidence_score"
        ]
      },
      "capabilities": [
        "classification",
        "triage"
      ]
    }
  },
  "metadata": {
    "domain": "healthcare",
    "tags": [
      "ml",
      "triage",
      "diagnosis"
    ]
  }
}
